{
  "schema_version": 3,
  "brand": {
    "slug": "glitchpad",
    "title": "Glitchpad",
    "affiliation": {
      "ownership": "shruggietech-owned",
      "showcase": "public",
      "parent": "ShruggieTech",
      "inheritance": "shruggietech-house",
      "endorsement": "shruggietech-project",
      "service_credit": "none"
    },
    "brand_version": "1.1.0"
  },
  "versions": {
    "canon_version": "1.2.1",
    "interface_canon_version": "1.0.0",
    "component_recipe_version": "1.1.0",
    "web_react_adapter_version": "1.1.0",
    "egui_adapter_version": "1.0.0",
    "compiler_version": "1.3.0",
    "brand_version": "1.1.0"
  },
  "version_semantics": {
    "canon_version": "Brand Canon governing identity and inherited brand values.",
    "interface_canon_version": "Interface Canon governing renderer-neutral UI semantics.",
    "component_recipe_version": "Bounded shared component grammar and behavior contract.",
    "web_react_adapter_version": "Generated Web/React implementation contract.",
    "egui_adapter_version": "Generated Rust and egui implementation contract.",
    "compiler_version": "BrandBuilder distribution that generated this contract.",
    "brand_version": "Consumer brand source contract version."
  },
  "compatibility": {
    "policy_version": "1.0.0",
    "status": "compatible",
    "validated_versions": {
      "brand": "1.1.0",
      "brand_canon": "1.2.1",
      "compiler": "1.3.0",
      "component_recipes": "1.1.0",
      "egui_adapter": "1.0.0",
      "interface_canon": "1.0.0",
      "web_react_adapter": "1.1.0"
    },
    "rules_checked": 13,
    "publication_status": "candidate",
    "adoption_status": "unadopted"
  },
  "environment": {
    "renderer": "renderer-neutral",
    "host": "none",
    "supported_targets": [
      "web",
      "native"
    ],
    "viewport_profiles": [
      "compact",
      "medium",
      "expanded",
      "unbounded"
    ],
    "adapter_versions": {
      "web-tokens": "1.1.0",
      "web-react": "1.1.0",
      "egui": "1.0.0",
      "nextjs-compatibility": "1.3.0"
    }
  },
  "authority": {
    "brand_source": "brand.json",
    "interface_canon": "enforcement/interface-canon.json",
    "component_recipes": "enforcement/component-recipes.json",
    "version_policy": "enforcement/version-policy.json",
    "web_adapter": "web/adapter.json",
    "support_matrix": "web/support-matrix.json",
    "egui_adapter": "native/egui/adapter.json",
    "egui_support_matrix": "native/egui/support-matrix.json",
    "instructions": "enforcement/IMPLEMENTATION.md",
    "documentation_contract": "enforcement/documentation-contract.json",
    "documentation_facts": "enforcement/documentation-facts.json",
    "precedence": [
      "brand.json",
      "enforcement/interface-canon.json",
      "enforcement/component-recipes.json",
      "enforcement/version-policy.json",
      "enforcement/documentation-contract.json",
      "enforcement/consumer-contract.json",
      "human instructions that do not conflict"
    ],
    "permitted_exceptions": [
      "token definition files may contain governed literals",
      "renderer metadata may contain documented platform-required literals"
    ]
  },
  "verification": {
    "entry_points": [
      "python3 enforcement/brandbuilder/templates/verify.py .",
      "python3 enforcement/brandbuilder/templates/validate_glyph.py brand.json"
    ],
    "success": "zero verifier problems and zero glyph failures"
  },
  "recovery": {
    "distribution": "shruggie-brandbuilder-1.3.0.skill",
    "path": "enforcement/distributions/shruggie-brandbuilder-1.3.0.skill",
    "sha256": "3f6fb82c75d7689cccef7b9909eb1cc848939e1192bfc92b2e1f5fafc20bd984",
    "extract_to": "enforcement/brandbuilder",
    "sources": [
      {
        "kind": "delivered-bundle",
        "path": "enforcement/distributions/shruggie-brandbuilder-1.3.0.skill",
        "network_required": false
      },
      {
        "kind": "authoritative-release",
        "version": "1.3.0",
        "network_requires_authorization": true
      }
    ],
    "instruction": "Verify the delivered SHA-256, then extract the exact archive into the empty enforcement/brandbuilder directory. Never substitute another version."
  },
  "capability_gap": {
    "template_path": "enforcement/capability-gap.example.json",
    "submission_requires_authorization": true
  },
  "provenance": [
    {
      "path": "brand.json",
      "bytes": 13487,
      "sha256": "c231bea5a8427f66c9f206fc84c62ad7b40f3737830746d64f2c1d63dcf15455"
    },
    {
      "path": "enforcement/AGENTS.md",
      "bytes": 1193,
      "sha256": "f942b408032156743e6934121274974cbfa18b057cbc359d21c217427017c236"
    },
    {
      "path": "enforcement/IMPLEMENTATION.md",
      "bytes": 7244,
      "sha256": "0d4d1b32e59f5a1acedc3076df6e27097b14b43a071762bf98aacc09a5dfaa39"
    },
    {
      "path": "enforcement/interface-canon.json",
      "bytes": 9089,
      "sha256": "8ab7e586393d7015d86a98940426a7400765386721a92a4d9be4a1cc6a715658"
    },
    {
      "path": "enforcement/interface-canon.schema.json",
      "bytes": 7313,
      "sha256": "b21d2a7b62cd302df62e8d4a3d0a1033f98a8d75d3a193fced61429cf40c656d"
    },
    {
      "path": "enforcement/component-recipes.json",
      "bytes": 23397,
      "sha256": "0596d74787c7cdc0723ad6b4b088f6f939f5f9ef78f7de7f35fa9049dccd3706"
    },
    {
      "path": "enforcement/component-recipes.schema.json",
      "bytes": 2793,
      "sha256": "280f5fad0174b16ccea1f91e19c100345c6a2185aef4ac2e8794f575cc3971e4"
    },
    {
      "path": "enforcement/version-policy.json",
      "bytes": 6978,
      "sha256": "4f6fef7abccee75e7390001bc7382909f0122c8e6d527c6dc8ad22f31f107cfe"
    },
    {
      "path": "enforcement/consumer-contract.schema.json",
      "bytes": 6833,
      "sha256": "13fd247d5272249c05b1d847cfd0442b886ea6a24f0e05ecc237ecb4b612d089"
    },
    {
      "path": "enforcement/documentation-contract.json",
      "bytes": 12104,
      "sha256": "8fcd7a2776bcbe72aea5d0c7a0dea0addfba27aff8c6667d2ab793f538732350"
    },
    {
      "path": "enforcement/documentation-contract.schema.json",
      "bytes": 3427,
      "sha256": "048bc07459f8dc2c50cef183fb0b8208702470033e41d83591d37d6cb4d313cb"
    },
    {
      "path": "enforcement/documentation-facts.json",
      "bytes": 3144,
      "sha256": "2f75d893dd90f8a615e1f44b8f9bd3f469a3551da2f00c181a53aa54abc0f041"
    },
    {
      "path": "web/adapter.json",
      "bytes": 1811,
      "sha256": "e60f8f5bbff19cb7ab4cc9b2986ef2a58e9fcdefe380e075caadadf374166e15"
    },
    {
      "path": "web/support-matrix.json",
      "bytes": 3041,
      "sha256": "2b4045f5c9302440b8fb80df634295c3be4b096aa141a0f08c675f0f9680668b"
    },
    {
      "path": "native/egui/Cargo.lock",
      "bytes": 19847,
      "sha256": "a0a17416dadc8d4a2ed9a41dd64f6aeda5a4fdd45856e43dca2593b14ddb23cc"
    },
    {
      "path": "native/egui/adapter.json",
      "bytes": 2004,
      "sha256": "fa1ef7046eed86dc7933676151b093a47decde823653fc0a236099ce8fa5f2b9"
    },
    {
      "path": "native/egui/support-matrix.json",
      "bytes": 7817,
      "sha256": "7c89d86d7be7362fc37c422986b745a8c170d2e4a961baa5d95cb8e4451bf974"
    },
    {
      "path": "enforcement/capability-gap.example.json",
      "bytes": 476,
      "sha256": "6f892e22ba6c72ee13e64d91fb48220553337ad6cdf0e62758b892c64cef5e96"
    },
    {
      "path": "enforcement/distributions/shruggie-brandbuilder-1.3.0.skill",
      "bytes": 416320,
      "sha256": "3f6fb82c75d7689cccef7b9909eb1cc848939e1192bfc92b2e1f5fafc20bd984"
    }
  ]
}
